{
  "$schema": "http://json-schema.org/draft-07/schema#",
  "type": [
    "object",
    "null"
  ],
  "title": "Monitor Schema",
  "description": "Schema for monitor components",
  "required": [
    "metadata"
  ],
  "properties": {
    "opendb_id": {
      "type": [
        "string",
        "null"
      ],
      "description": "Unique identifier for the document (UUID v4)"
    },
    "screen_size": {
      "type": [
        "number",
        "null"
      ],
      "description": "Screen size in inches"
    },
    "resolution": {
      "type": [
        "object",
        "null"
      ],
      "description": "Resolution of the monitor",
      "required": [
        "horizontalRes",
        "verticalRes"
      ],
      "properties": {
        "horizontalRes": {
          "type": [
            "number",
            "null"
          ],
          "description": "Horizontal resolution in pixels"
        },
        "verticalRes": {
          "type": [
            "number",
            "null"
          ],
          "description": "Vertical resolution in pixels"
        }
      }
    },
    "refresh_rate": {
      "type": [
        "number",
        "null"
      ],
      "description": "Maximum refresh rate in Hz"
    },
    "panel_type": {
      "type": [
        "string",
        "null"
      ],
      "description": "Type of panel (IPS, VA, TN, OLED, etc.)"
    },
    "response_time": {
      "type": [
        "number",
        "null"
      ],
      "description": "Gray-to-gray response time in milliseconds"
    },
    "color": {
      "type": [
        "array",
        "null"
      ],
      "items": {
        "type": [
          "string",
          "null"
        ]
      },
      "description": "The color of this product (e.g., ['Black', 'Red']). Each color of the product should be included in the array."
    },
    "viewing_angle": {
      "type": [
        "string",
        "null"
      ],
      "description": "Viewing angles (e.g., '178°/178°')"
    },
    "aspect_ratio": {
      "type": [
        "string",
        "null"
      ],
      "description": "Aspect ratio (e.g., '16:9', '21:9')"
    },
    "connectors": {
      "type": [
        "string",
        "null"
      ],
      "description": "Available ports and connections"
    },
    "max_brightness": {
      "type": [
        "string",
        "null"
      ],
      "description": "Maximum brightness in nits"
    },
    "hdr": {
      "type": [
        "string",
        "null"
      ],
      "description": "HDR support and certification"
    },
    "adaptive_sync": {
      "type": [
        "string",
        "null"
      ],
      "description": "Adaptive sync technology (G-Sync, FreeSync, etc.)"
    },
    "metadata": {
      "type": [
        "object",
        "null"
      ],
      "required": [
        "name"
      ],
      "properties": {
        "name": {
          "type": "string",
          "description": "Full product name"
        },
        "manufacturer": {
          "type": [
            "string",
            "null"
          ],
          "description": "Product manufacturer"
        },
        "part_numbers": {
          "type": [
            "array",
            "null"
          ],
          "items": {
            "type": "string"
          },
          "description": "Array of manufacturer's part numbers/SKUs"
        },
        "series": {
          "type": [
            "string",
            "null"
          ],
          "description": "Product series name"
        },
        "variant": {
          "type": [
            "string",
            "null"
          ],
          "description": "Specific variant in the series"
        },
        "releaseYear": {
          "type": [
            "number",
            "null"
          ],
          "description": "Year of release"
        }
      }
    },
    "general_product_information": {
      "type": [
        "object",
        "null"
      ],
      "description": "General product information and retailer SKUs",
      "properties": {
        "amazon_sku": {
          "type": [
            "string",
            "null"
          ],
          "description": "Amazon product SKU"
        },
        "newegg_sku": {
          "type": [
            "string",
            "null"
          ],
          "description": "Newegg product SKU"
        },
        "bestbuy_sku": {
          "type": [
            "number",
            "null"
          ],
          "description": "Best Buy product SKU"
        },
        "walmart_sku": {
          "type": [
            "number",
            "null"
          ],
          "description": "Walmart product SKU"
        },
        "adorama_sku": {
          "type": [
            "string",
            "null"
          ],
          "description": "Adorama product SKU"
        },
        "manufacturer_url": {
          "type": [
            "string",
            "null"
          ],
          "description": "Official manufacturer product URL"
        }
      }
    }
  }
}