{
  "opendb_id": "3b7255a5-4df2-4741-891a-e7099d6a97b5",
  "resolution": {
    "horizontalRes": 3440,
    "verticalRes": 1440
  },
  "metadata": {
    "name": "Acer ED7 34\" 3440x1440 100Hz VA Curved Monitor",
    "manufacturer": "Acer",
    "part_numbers": [
      "ED347CKR bmidphzx                                                    UM.CE7AA.001                                                    ED347CKR bmidphzx (UM.CE7AA.001)"
    ],
    "series": "",
    "variant": "Black",
    "model": "ED7"
  },
  "screen_size": 34,
  "refresh_rate": 100,
  "panel_type": "VA",
  "response_time": 4,
  "color": [
    "BLACK"
  ],
  "viewing_angle": "178° H x 178° V",
  "aspect_ratio": "21:9",
  "connectors": "1 x HDMI                                                    1 x DVI-D Dual Link                                                    1 x DisplayPort",
  "max_brightness": "300 cd/m²",
  "hdr": "",
  "adaptive_sync": "FreeSync",
  "general_product_information": {}
}