{
  "opendb_id": "0165416b-b12e-4ada-b186-240a5093379f",
  "resolution": {
    "horizontalRes": 3840,
    "verticalRes": 2160
  },
  "metadata": {
    "name": "Dell P4317Q 42.5\" 4K 60Hz IPS Monitor",
    "manufacturer": "Dell",
    "part_numbers": [
      "P4317Q"
    ],
    "series": "",
    "variant": "",
    "model": "P4317Q"
  },
  "screen_size": 42.51,
  "refresh_rate": 60,
  "panel_type": "IPS",
  "response_time": 8,
  "color": [],
  "viewing_angle": "178° H x 178° V",
  "aspect_ratio": "16:9",
  "connectors": "2 x HDMI                                                    1 x VGA                                                    1 x DisplayPort                                                    1 x Mini-DisplayPort",
  "max_brightness": "350 cd/m²",
  "hdr": "",
  "adaptive_sync": "None",
  "general_product_information": {}
}