{
  "opendb_id": "e6bddd9f-8ca1-4c31-ae5a-c3f8d24be3b1",
  "resolution": {
    "horizontalRes": 3840,
    "verticalRes": 2160
  },
  "metadata": {
    "name": "Wasabi Mango UHD550 REAL 4K HDMI 2.0 55\" REAL 4K 60Hz IPS Monitor",
    "manufacturer": "Wasabi Mango",
    "part_numbers": [
      "UHD550 REAL 4K HDMI 2.0"
    ],
    "series": "",
    "variant": "",
    "model": "UHD550 REAL 4K HDMI 2.0"
  },
  "screen_size": 55,
  "refresh_rate": 60,
  "panel_type": "IPS",
  "response_time": 5,
  "color": [],
  "viewing_angle": "178° H x 178° V",
  "aspect_ratio": "16:9",
  "connectors": "4 x HDMI                                                    1 x DisplayPort",
  "max_brightness": "400 cd/m²",
  "hdr": "",
  "adaptive_sync": "None",
  "general_product_information": {}
}