{
  "opendb_id": "42e8e744-ee32-4631-872c-a555dd0a9e14",
  "resolution": {
    "horizontalRes": 1920,
    "verticalRes": 1080
  },
  "metadata": {
    "name": "Acer KG241Q bmiix 23.6\" 1080p 75Hz TN Monitor",
    "manufacturer": "Acer",
    "part_numbers": [
      "KG241Q bmiix"
    ],
    "series": "",
    "variant": "Black",
    "model": "KG241Q bmiix"
  },
  "screen_size": 23.6,
  "refresh_rate": 75,
  "panel_type": "TN",
  "response_time": 0,
  "color": [
    "BLACK"
  ],
  "viewing_angle": "170° H x 160° V",
  "aspect_ratio": "16:9",
  "connectors": "1 x HDMI                                                    1 x VGA",
  "max_brightness": "300 cd/m²",
  "hdr": "",
  "adaptive_sync": "FreeSync",
  "general_product_information": {
    "amazon_sku": "B06XYGQBY2",
    "walmart_sku": 596160336
  }
}