{
  "opendb_id": "5358504e-d0f9-44c6-9e24-2cc70c56eff3",
  "resolution": {
    "horizontalRes": 3840,
    "verticalRes": 2160
  },
  "metadata": {
    "name": "Sony INZONE M9 II 27\" 4K 160Hz IPS Monitor",
    "manufacturer": "Sony",
    "part_numbers": [
      "SDM27U9M2                                                    sdm27u9m2b"
    ],
    "series": "",
    "variant": "Black",
    "model": "SDM27U9M2                                                    sdm27u9m2b"
  },
  "screen_size": 27,
  "refresh_rate": 160,
  "panel_type": "IPS",
  "response_time": 1,
  "color": [
    "BLACK"
  ],
  "viewing_angle": "178° H x 178° V",
  "aspect_ratio": "16:9",
  "connectors": "2 x HDMI 2.1                                                    1 x DisplayPort 2.1",
  "max_brightness": "400 cd/m²",
  "hdr": "",
  "adaptive_sync": "FreeSync                                                    G-Sync Compatible",
  "general_product_information": {
    "amazon_sku": "B0D9R8YPK3",
    "walmart_sku": 14396050308
  }
}