{
  "opendb_id": "5745644a-3914-49a1-8d27-eec3fdbb05d9",
  "resolution": {
    "horizontalRes": 1920,
    "verticalRes": 1080
  },
  "metadata": {
    "name": "Dell P2417H 23.8\" 1080p 60Hz IPS Monitor",
    "manufacturer": "Dell",
    "part_numbers": [
      "P2417H                                                    K8W3D                                                    210-AIIM                                                    210-AJEX"
    ],
    "series": "",
    "variant": "Black",
    "model": "P2417H                                                    K8W3D                                                    210-AIIM                                                    210-AJEX"
  },
  "screen_size": 23.8,
  "refresh_rate": 60,
  "panel_type": "IPS",
  "response_time": 6,
  "color": [
    "BLACK"
  ],
  "viewing_angle": "178° H x 178° V",
  "aspect_ratio": "16:9",
  "connectors": "1 x HDMI                                                    1 x VGA                                                    1 x DisplayPort",
  "max_brightness": "250 cd/m²",
  "hdr": "",
  "adaptive_sync": "None",
  "general_product_information": {
    "amazon_sku": "B01FGCJE26",
    "walmart_sku": 52514890
  }
}