{
  "opendb_id": "37594e7e-75e4-4c84-b197-29d9ab1f4acd",
  "resolution": {
    "horizontalRes": 1920,
    "verticalRes": 1080
  },
  "metadata": {
    "name": "Asus VZ22EHE 21.4\" 1080p 75Hz IPS Monitor",
    "manufacturer": "Asus",
    "part_numbers": [
      "90LM0910-B014B0                                                    90lm0910-b01470                                                    VZ22EHE"
    ],
    "series": "",
    "variant": "Black"
  },
  "screen_size": 21.45,
  "refresh_rate": 75,
  "panel_type": "IPS",
  "response_time": 0,
  "color": [
    "BLACK"
  ],
  "viewing_angle": "178° H x 178° V",
  "aspect_ratio": "16:9",
  "connectors": "1 x HDMI 1.4                                                    1 x VGA",
  "max_brightness": "250 cd/m²",
  "hdr": "",
  "adaptive_sync": "FreeSync",
  "general_product_information": {
    "amazon_sku": "B0C2ZC961D",
    "walmart_sku": 5001667592
  }
}