{
  "opendb_id": "815568ea-4d65-456e-b6bc-47b1c710806e",
  "resolution": {
    "horizontalRes": 1920,
    "verticalRes": 1080
  },
  "metadata": {
    "name": "ViewSonic OMNI VX2428 23.8\" 1080p 180Hz IPS Monitor",
    "manufacturer": "ViewSonic",
    "part_numbers": [
      "VX2428 180Hz"
    ],
    "series": "",
    "variant": "Black",
    "model": "OMNI VX2428"
  },
  "screen_size": 23.8,
  "refresh_rate": 180,
  "panel_type": "IPS",
  "response_time": 0,
  "color": [
    "BLACK"
  ],
  "viewing_angle": "178° H x 178° V",
  "aspect_ratio": "16:9",
  "connectors": "2 x HDMI 1.4                                                    1 x DisplayPort 1.4",
  "max_brightness": "250 cd/m²",
  "hdr": "",
  "adaptive_sync": "FreeSync Premium",
  "general_product_information": {}
}