{
  "opendb_id": "1d518b02-fdb2-41fe-b263-b409b6cc698a",
  "resolution": {
    "horizontalRes": 1920,
    "verticalRes": 1080
  },
  "metadata": {
    "name": "Samsung LC27FG70FQNXZA 27\" 1080p 144Hz VA Curved Monitor",
    "manufacturer": "Samsung",
    "part_numbers": [
      "LC27FG70FQNXZA"
    ],
    "series": "",
    "variant": "",
    "model": "LC27FG70FQNXZA"
  },
  "screen_size": 27,
  "refresh_rate": 144,
  "panel_type": "VA",
  "response_time": 1,
  "color": [],
  "viewing_angle": "178° H x 178° V",
  "aspect_ratio": "16:9",
  "connectors": "2 x HDMI                                                    1 x DisplayPort",
  "max_brightness": "350 cd/m²",
  "hdr": "",
  "adaptive_sync": "FreeSync",
  "general_product_information": {}
}