{
  "opendb_id": "da412df5-5367-4321-9eca-e3c581639625",
  "resolution": {
    "horizontalRes": 1280,
    "verticalRes": 1024
  },
  "metadata": {
    "name": "Acer UM.BV6AA.002 17\" 1280x1024 75Hz TN Monitor",
    "manufacturer": "Acer",
    "part_numbers": [
      "UM.BV6AA.002"
    ],
    "series": "",
    "variant": "",
    "model": "UM.BV6AA.002"
  },
  "screen_size": 17,
  "refresh_rate": 75,
  "panel_type": "TN",
  "response_time": 5,
  "color": [],
  "viewing_angle": "",
  "aspect_ratio": "5:4",
  "connectors": "1 x VGA",
  "max_brightness": "250 cd/mÂ²",
  "hdr": "",
  "adaptive_sync": "None",
  "general_product_information": {}
}