{
  "opendb_id": "ae3eb35e-8b48-4e37-8aab-1300c43b7af5",
  "resolution": {
    "horizontalRes": 2560,
    "verticalRes": 1440
  },
  "metadata": {
    "name": "Acer XZ321QU bmijpphzx 31.5\" 1440p 144Hz VA Curved Monitor",
    "manufacturer": "Acer",
    "part_numbers": [
      "XZ321QU bmijpphzx"
    ],
    "series": "",
    "variant": "",
    "model": "XZ321QU bmijpphzx"
  },
  "screen_size": 31.5,
  "refresh_rate": 144,
  "panel_type": "VA",
  "response_time": 1,
  "color": [],
  "viewing_angle": "178° H x 178° V",
  "aspect_ratio": "16:9",
  "connectors": "2 x HDMI                                                    1 x DisplayPort                                                    1 x Mini-DisplayPort",
  "max_brightness": "300 cd/m²",
  "hdr": "",
  "adaptive_sync": "FreeSync",
  "general_product_information": {
    "amazon_sku": "B07CY1X7YL",
    "walmart_sku": 877590264
  }
}