{
  "opendb_id": "0aec24e8-9107-4d7e-917c-bd885eb0ce4f",
  "resolution": {
    "horizontalRes": 1920,
    "verticalRes": 1080
  },
  "metadata": {
    "name": "Asus VA249HE 23.8\" 1080p 60Hz VA Monitor",
    "manufacturer": "Asus",
    "part_numbers": [
      "VA249HE                                                    90LM02W1-B02370"
    ],
    "series": "",
    "variant": "Black",
    "model": "VA249HE                                                    90LM02W1-B02370"
  },
  "screen_size": 23.8,
  "refresh_rate": 60,
  "panel_type": "VA",
  "response_time": 5,
  "color": [
    "BLACK"
  ],
  "viewing_angle": "178° H x 178° V",
  "aspect_ratio": "16:9",
  "connectors": "1 x HDMI                                                    1 x VGA",
  "max_brightness": "250 cd/m²",
  "hdr": "",
  "adaptive_sync": "None",
  "general_product_information": {
    "amazon_sku": "B07HH86RT6",
    "newegg_sku": "N82E16824236922",
    "walmart_sku": 647412618
  }
}