{
  "opendb_id": "635f8b49-3198-49ed-9b53-09899e2632f5",
  "resolution": {
    "horizontalRes": 2560,
    "verticalRes": 1440
  },
  "metadata": {
    "name": "Acer XB273U GXbmiipruzx 27\" 1440p 240Hz IPS Monitor",
    "manufacturer": "Acer",
    "part_numbers": [
      "UM.HX3AA.X05"
    ],
    "series": "",
    "variant": "Black / Red",
    "model": "XB273U GXbmiipruzx"
  },
  "screen_size": 27,
  "refresh_rate": 240,
  "panel_type": "IPS",
  "response_time": 1,
  "color": [
    "BLACK",
    "RED"
  ],
  "viewing_angle": "178° H x 178° V",
  "aspect_ratio": "16:9",
  "connectors": "2 x HDMI                                                    1 x DisplayPort",
  "max_brightness": "400 cd/m²",
  "hdr": "",
  "adaptive_sync": "G-Sync Compatible",
  "general_product_information": {
    "amazon_sku": "B095X5T99T",
    "newegg_sku": "9SIA8X5K1F7647",
    "walmart_sku": 686810234
  }
}