{
  "opendb_id": "f316fa4d-6f95-4517-881c-871a0f8e9aa5",
  "resolution": {
    "horizontalRes": 2560,
    "verticalRes": 1440
  },
  "metadata": {
    "name": "Corsair XENEON 315QHD165 31.5\" 1440p 165Hz IPS Monitor",
    "manufacturer": "Corsair",
    "part_numbers": [
      "CM-9020007-NA"
    ],
    "series": "",
    "variant": "Black",
    "model": "XENEON 315QHD165"
  },
  "screen_size": 31.5,
  "refresh_rate": 165,
  "panel_type": "IPS",
  "response_time": 8,
  "color": [
    "BLACK"
  ],
  "viewing_angle": "178° H x 178° V",
  "aspect_ratio": "16:9",
  "connectors": "2 x HDMI 2.0                                                    1 x DisplayPort 1.4",
  "max_brightness": "300 cd/m²",
  "hdr": "",
  "adaptive_sync": "FreeSync Premium                                                    G-Sync Compatible",
  "general_product_information": {
    "amazon_sku": "B0CND6MWLW"
  }
}